<?xml version="1.0" encoding="UTF-8"?>
<ROOT xmlns="https://www.weareavp.com/nunncenter/ohms" xmlns:xsi="http://www.w3.org/2001/XMLSchema-instance" xsi:schemaLocation="https://www.weareavp.com/nunncenter/ohms/ohms.xsd"><record id="00089280" dt="2020-04-08"><version>5.4</version><date value="" format="yyyy-mm-dd"/><date_nonpreferred_format>Unknown Date</date_nonpreferred_format><cms_record_id></cms_record_id><title>Oral history interview with Hubert N. Alyea</title><accession>OH0010</accession><duration></duration><collection_id></collection_id><collection_name></collection_name><series_id></series_id><series_name></series_name><repository>Science History Institute</repository><funding></funding><repository_url /><file_name></file_name><sync></sync><sync_alt></sync_alt><transcript_alt_lang></transcript_alt_lang><translate>0</translate><media_id></media_id><media_url>https://scihist-digicoll-production-derivatives.s3.amazonaws.com/combined_audio_derivatives/29028ec1-d42e-44c3-af0c-f7e60078b5e7/combined_5914c48cb298d093a994d9b562119d94.mp3</media_url><mediafile><host>Other</host><avalon_target_domain></avalon_target_domain><host_account_id></host_account_id><host_player_id></host_player_id><host_clip_id></host_clip_id><clip_format>audio</clip_format></mediafile><kembed></kembed><language></language><user_notes></user_notes><type></type><description></description><rel /><transcript>No transcript.</transcript><transcript_alt></transcript_alt><rights></rights><fmt>audio</fmt><usage></usage><userestrict>0</userestrict><xmllocation></xmllocation><xmlfilename></xmlfilename><collection_link></collection_link><series_link></series_link></record></ROOT>
